{
  "schema_version": "1.0",
  "git_commit": "fe881856f4e8bd5d89928601ba3564c73dbc1ebb",
  "total_cases": 28,
  "cases": [
    {
      "id": "rc7_school_normal",
      "context": "school",
      "category": "normal",
      "inputs": {
        "预设模板": "无 (None)",
        "风格配方": "无 (None)",
        "场景大类": "教室",
        "剧情主题": "教师/学生系列",
        "景别构图": "自动 (Auto)",
        "拍摄视角": "自动 (Auto)",
        "裸露等级": "L1 包裹暗示 (Fully Clothed / Suggestive)",
        "服装款式": "水手服 (JK Sailor Suit)",
        "服装状态": "整齐穿着 (Neat)",
        "发型发色": "随机 (Random)",
        "饰品头饰": "无 (None)",
        "妆容细节": "无 (None)",
        "姿势动作": "随机 (Random)",
        "情绪表情": "随机 (Random)",
        "光影预设": "自动 (Auto)",
        "胶片风格": "无 (None)",
        "液体效果": "无 (None)",
        "纹身标记": "无 (None)",
        "道具物件": "无 (None)",
        "角色设定": "无 (None)",
        "真实微瑕": "无 (None)",
        "画质等级": "高清写真 (High)",
        "prompt_seed": 1000
      },
      "oracle": {
        "expected_context": "school",
        "expected_clothing": "水手服 (JK Sailor Suit)",
        "expected_nudity": "L1",
        "has_conflict": false,
        "protected_explicit_tags": [
          "classroom",
          "strict teacher",
          "dressed",
          "neatly worn sailor uniform",
          "best quality",
          "podium",
          "student council",
          "fabric hugging curves",
          "tucked white shirt",
          "detailed",
          "classroom window",
          "body outline visible through fabric",
          "crisp pleated skirt",
          "photorealistic"
        ],
        "allowed_drops": [],
        "allowed_replaces": [],
        "rc7_drop_count": 0,
        "new_hard_conflict_evidence": []
      },
      "baseline_output": {
        "positive": "empty classroom, podium, tutor, teacher lounge, after school lesson, medium long shot, knee-up shot, over the shoulder shot, modest outfit, nothing exposed, neatly worn sailor uniform, tucked white shirt, crisp pleated skirt, lit side to camera, full face lighting, twirling with hair whipping, eyes squeezed shut in pleasure, arched eyebrows, chin length bob, sleek modern bob, best quality, detailed, photorealistic",
        "negative": "low quality, worst quality, blurry, jpeg artifacts, watermark, deformed, bad anatomy, bad mouth, bad teeth, weird tongue, distorted lips, extra limbs, extra fingers, mutated hands, bad proportions, ugly, disfigured, cropped, out of frame",
        "description": "场景: 教室 | 主题: 教师/学生系列 | 服装: 水手服 (JK Sailor Suit) | 裸露: L1 | 发型: 随机 (Random)"
      }
    },
    {
      "id": "rc7_school_conflict",
      "context": "school",
      "category": "conflict",
      "inputs": {
        "预设模板": "无 (None)",
        "风格配方": "无 (None)",
        "场景大类": "教室",
        "剧情主题": "教师/学生系列",
        "景别构图": "近景 CU (面部表情/眼神)",
        "拍摄视角": "自动 (Auto)",
        "裸露等级": "L5 极致全裸 (Full Nude)",
        "服装款式": "水手服 (JK Sailor Suit)",
        "服装状态": "整齐穿着 (Normal Wearing)",
        "发型发色": "随机 (Random)",
        "饰品头饰": "无 (None)",
        "妆容细节": "无 (None)",
        "姿势动作": "🧎 跪姿系列",
        "情绪表情": "😖 痛苦/折磨（SM·凌辱专用）",
        "光影预设": "自动 (Auto)",
        "胶片风格": "无 (None)",
        "液体效果": "🥛 颜射/精液残留 (Cum Splatter & Semen Residual)",
        "纹身标记": "无 (None)",
        "道具物件": "无 (None)",
        "角色设定": "无 (None)",
        "真实微瑕": "无 (None)",
        "画质等级": "高清写真 (High)",
        "prompt_seed": 6000
      },
      "oracle": {
        "expected_context": "school",
        "conflict_type": "nudity_clothing_or_shot_anatomy",
        "has_conflict": true,
        "protected_explicit_tags": [
          "empty classroom",
          "after school lesson",
          "close-up",
          "completely unclothed",
          "wrists bound behind",
          "furrowed brows",
          "traces of white cum on skin",
          "best quality",
          "teacher desk",
          "detention with student",
          "face shot filling frame",
          "naked",
          "arms at sides",
          "whimpering expression",
          "milky white fluid glistening",
          "detailed",
          "podium",
          "private lesson",
          "grimacing",
          "photorealistic"
        ],
        "allowed_drops": [
          {
            "rule_id": "nudity_clothing_conflicts",
            "reason_code": "nudity_removes_clothing",
            "before_text": "fully nude",
            "target_atom_id": "atom_e1a6b2007d0596cf1a1703d5",
            "winner_atom_ids": [
              "atom_585315f7416920dc0bfbfd17"
            ]
          },
          {
            "rule_id": "nudity_clothing_conflicts",
            "reason_code": "nudity_removes_clothing",
            "before_text": "sailor uniform and skirt tossed aside on desk",
            "target_atom_id": "atom_fa48ee45fcf49f2518c5837f",
            "winner_atom_ids": [
              "atom_585315f7416920dc0bfbfd17"
            ]
          },
          {
            "rule_id": "nudity_clothing_conflicts",
            "reason_code": "nudity_removes_clothing",
            "before_text": "completely bare skin",
            "target_atom_id": "atom_1412d6e47d9401a6e345ca3c",
            "winner_atom_ids": [
              "atom_585315f7416920dc0bfbfd17"
            ]
          },
          {
            "rule_id": "nudity_clothing_conflicts",
            "reason_code": "nudity_removes_clothing",
            "before_text": "loose socks",
            "target_atom_id": "atom_10a27e67862fb59578ff4493",
            "winner_atom_ids": [
              "atom_585315f7416920dc0bfbfd17"
            ]
          }
        ],
        "allowed_replaces": [],
        "rc7_drop_count": 0,
        "new_hard_conflict_evidence": [
          {
            "rule_id": "nudity_clothing_conflicts",
            "reason_code": "nudity_removes_clothing",
            "physical_domain": "nudity_coverage",
            "violated_invariant": "Worn garments or underwear cannot coexist with full body nudity",
            "target_atom_id": "atom_e1a6b2007d0596cf1a1703d5",
            "winner_atom_ids": [
              "atom_585315f7416920dc0bfbfd17"
            ],
            "winner_texts": [
              "completely unclothed"
            ],
            "loser_text": "fully nude",
            "before_text": "fully nude",
            "after_text": null,
            "winner_semantic_facts": {
              "semantic_role": "selector",
              "visible_regions": [
                "upper_body"
              ]
            },
            "loser_semantic_facts": {
              "semantic_role": "selector",
              "garment_topologies": [
                "bottom_skirt",
                "top"
              ]
            }
          },
          {
            "rule_id": "nudity_clothing_conflicts",
            "reason_code": "nudity_removes_clothing",
            "physical_domain": "nudity_coverage",
            "violated_invariant": "Worn garments or underwear cannot coexist with full body nudity",
            "target_atom_id": "atom_fa48ee45fcf49f2518c5837f",
            "winner_atom_ids": [
              "atom_585315f7416920dc0bfbfd17"
            ],
            "winner_texts": [
              "completely unclothed"
            ],
            "loser_text": "sailor uniform and skirt tossed aside on desk",
            "before_text": "sailor uniform and skirt tossed aside on desk",
            "after_text": null,
            "winner_semantic_facts": {
              "semantic_role": "selector",
              "visible_regions": [
                "upper_body"
              ]
            },
            "loser_semantic_facts": {
              "semantic_role": "selector",
              "garment_topologies": [
                "bottom_skirt",
                "top"
              ]
            }
          },
          {
            "rule_id": "nudity_clothing_conflicts",
            "reason_code": "nudity_removes_clothing",
            "physical_domain": "nudity_coverage",
            "violated_invariant": "Worn garments or underwear cannot coexist with full body nudity",
            "target_atom_id": "atom_1412d6e47d9401a6e345ca3c",
            "winner_atom_ids": [
              "atom_585315f7416920dc0bfbfd17"
            ],
            "winner_texts": [
              "completely unclothed"
            ],
            "loser_text": "completely bare skin",
            "before_text": "completely bare skin",
            "after_text": null,
            "winner_semantic_facts": {
              "semantic_role": "selector",
              "visible_regions": [
                "upper_body"
              ]
            },
            "loser_semantic_facts": {
              "semantic_role": "selector",
              "garment_topologies": [
                "bottom_skirt",
                "top"
              ]
            }
          },
          {
            "rule_id": "nudity_clothing_conflicts",
            "reason_code": "nudity_removes_clothing",
            "physical_domain": "nudity_coverage",
            "violated_invariant": "Worn garments or underwear cannot coexist with full body nudity",
            "target_atom_id": "atom_10a27e67862fb59578ff4493",
            "winner_atom_ids": [
              "atom_585315f7416920dc0bfbfd17"
            ],
            "winner_texts": [
              "completely unclothed"
            ],
            "loser_text": "loose socks",
            "before_text": "loose socks",
            "after_text": null,
            "winner_semantic_facts": {
              "semantic_role": "selector",
              "visible_regions": [
                "upper_body"
              ]
            },
            "loser_semantic_facts": {
              "semantic_role": "selector",
              "garment_topologies": [
                "bottom_skirt",
                "top"
              ]
            }
          }
        ]
      },
      "baseline_output": {